{
    "title": "Take the A Train",
    "composer": "Billy Strayhorn",
    "key": "C",
    "sections": [
      {
        "title": "Intro",
        "chords": [
          {"name": "C", "duration": 4},
          {"name": "C7", "duration": 4},
          {"name": "F", "duration": 4},
          {"name": "Fm", "duration": 4}
        ]
      },
      {
        "title": "Verse",
        "chords": [
          {"name": "C", "duration": 4},
          {"name": "C7", "duration": 4},
          {"name": "F", "duration": 4},
          {"name": "Fm", "duration": 4},
          {"name": "C", "duration": 4},
          {"name": "C7", "duration": 4},
          {"name": "F", "duration": 4},
          {"name": "D7", "duration": 4}
        ]
      },
      {
        "title": "Chorus",
        "chords": [
          {"name": "G7", "duration": 4},
          {"name": "C", "duration": 4},
          {"name": "G7", "duration": 4},
          {"name": "C", "duration": 4},
          {"name": "F7", "duration": 4},
          {"name": "F#dim7", "duration": 4},
          {"name": "C", "duration": 4},
          {"name": "A7", "duration": 4}
        ]
      }
    ]
  }
  